Variável,Comunalidade
Eu gostaria de ganhar pontos ou créditos para trocar por produtos e serviços,0.9247295064619752
Eu gostaria de poder usar qualquer veículo do transporte público de forma ilimitada,0.7962589237826385
Eu gostaria de poder realizar uma compra antecipada por passagens ilimitadas no transporte público (pré-pago),0.8995563745196332
Eu gostaria de poder realizar um pagamento depois de usar passagens ilimitadas no transporte público (pós-pago),0.8849845413483526
Eu gostaria de ter a opção de pagar um valor diário por passagens ilimitadas no transporte público,0.9243980675612753
Eu gostaria de ter a opção de pagar um valor mensal por passagens ilimitadas no transporte público,0.9376813283742201
Eu gostaria de ter a opção de pagar um valor anual por passagens ilimitadas no transporte público,0.9062996580626435
Eu gostaria de receber um valor de volta por quilômetro viajado no transporte público ,0.9204440154486438
Eu gostaria de receber desconto na passagem por viajar em horários fora de pico,0.8512017201715404
